{
  "id": "first-world-mince-pie",
  "name": "recipes.first-world-mince-pie.name",
  "icon": "icons/consumables/food/cheese-round-glowing-yellow.webp",
  "basicIngredients": 8,
  "specialIngredients": 4,
  "cookingLoreDC": 45,
  "survivalDC": 47,
  "uuid": "Compendium.pf2e-kingmaker-tools.kingmaker-tools-meal-effects.RmMZWrzgd8Wh8z5H",
  "level": 20,
  "cost": {
    "currency": "gp",
    "value": 3500
  },
  "rarity": "rare",
  "criticalSuccess": {
    "effects": [
      {
        "uuid": "Compendium.pf2e-kingmaker-tools.kingmaker-tools-meal-effects.Item.69VWFB5UNLau1Rzt",
        "removeWhenPreparingCampsite": false
      },
      {
        "uuid": "Compendium.pf2e-kingmaker-tools.kingmaker-tools-meal-effects.Item.OAxcELiLh04BLVvP",
        "removeWhenPreparingCampsite": false
      },
      {
        "uuid": "Compendium.pf2e-kingmaker-tools.kingmaker-tools-meal-effects.Item.WVRQf9SLX0iRh3Ur",
        "removeWhenPreparingCampsite": false
      },
      {
        "uuid": "Compendium.pf2e-kingmaker-tools.kingmaker-tools-meal-effects.Item.69MQw1WMMlN4hEzb",
        "removeWhenPreparingCampsite": false
      },
      {
        "uuid": "Compendium.pf2e-kingmaker-tools.kingmaker-tools-meal-effects.Item.yLf2n65zVocqsl6r",
        "removeWhenPreparingCampsite": false
      },
      {
        "uuid": "Compendium.pf2e-kingmaker-tools.kingmaker-tools-meal-effects.Item.sd45BQ4P7BtsYEuP",
        "removeWhenPreparingCampsite": false
      }
    ],
    "chooseRandomly": true
  },
  "criticalFailure": {
    "effects": [
      {
        "uuid": "Compendium.pf2e-kingmaker-tools.kingmaker-tools-meal-effects.Item.72N0nZAAo2iuCGBd",
        "removeWhenPreparingCampsite": false
      }
    ]
  },
  "success": {
    "effects": [
      {
        "uuid": "Compendium.pf2e-kingmaker-tools.kingmaker-tools-meal-effects.Item.iV22sORhjIhWZMKw",
        "removeWhenPreparingCampsite": false
      },
      {
        "uuid": "Compendium.pf2e-kingmaker-tools.kingmaker-tools-meal-effects.Item.CQGJi8WiBq0T8Kc6",
        "removeWhenPreparingCampsite": false
      },
      {
        "uuid": "Compendium.pf2e-kingmaker-tools.kingmaker-tools-meal-effects.Item.L8HdDXKrfa3gDakt",
        "removeWhenPreparingCampsite": false
      },
      {
        "uuid": "Compendium.pf2e-kingmaker-tools.kingmaker-tools-meal-effects.Item.6CjFExnLSe9qij9z",
        "removeWhenPreparingCampsite": false
      },
      {
        "uuid": "Compendium.pf2e-kingmaker-tools.kingmaker-tools-meal-effects.Item.Af25wacbdYDnFKwM",
        "removeWhenPreparingCampsite": false
      },
      {
        "uuid": "Compendium.pf2e-kingmaker-tools.kingmaker-tools-meal-effects.Item.VhzUKWFVrZ7tgcEQ",
        "removeWhenPreparingCampsite": false
      }
    ],
    "chooseRandomly": true
  },
  "favoriteMeal": {
    "effects": [
      {
        "uuid": "Compendium.pf2e-kingmaker-tools.kingmaker-tools-meal-effects.Item.Wfmt1NvfIqF3gFav"
      }
    ]
  }
}
