{
  "id": "seasoned-wings-and-thighs",
  "name": "recipes.seasoned-wings-and-thighs.name",
  "icon": "icons/consumables/food/chicken-bird-cooked.webp",
  "basicIngredients": 4,
  "specialIngredients": 2,
  "cookingLoreDC": 30,
  "survivalDC": 32,
  "uuid": "Compendium.pf2e-kingmaker-tools.kingmaker-tools-meal-effects.BTKN1IgANoof0tfB",
  "level": 12,
  "cost": {
    "currency": "gp",
    "value": 100
  },
  "rarity": "uncommon",
  "criticalSuccess": {
    "effects": [
      {
        "uuid": "Compendium.pf2e-kingmaker-tools.kingmaker-tools-meal-effects.Item.uchgkN3hm1T51zfM",
        "removeAfterRest": true
      },
      {
        "uuid": "Compendium.pf2e-kingmaker-tools.kingmaker-tools-meal-effects.Item.JqKhpMXiQCEsDSCw",
        "removeWhenPreparingCampsite": false
      }
    ]
  },
  "success": {
    "effects": [
      {
        "uuid": "Compendium.pf2e-kingmaker-tools.kingmaker-tools-meal-effects.Item.JqKhpMXiQCEsDSCw"
      }
    ]
  },
  "criticalFailure": {
    "effects": [
      {
        "uuid": "Compendium.pf2e-kingmaker-tools.kingmaker-tools-meal-effects.Item.q3vnRHRBn3HmRhkV",
        "removeAfterRest": true
      }
    ]
  },
  "favoriteMeal": {
    "effects": [
      {
        "uuid": "Compendium.pf2e-kingmaker-tools.kingmaker-tools-meal-effects.Item.xF0K40VzyjIbbRMA",
        "removeWhenPreparingCampsite": false
      }
    ]
  },
  "requirements": "ability to cast fire spell"
}
