{
  "id": "hearty-purple-soup",
  "name": "recipes.hearty-purple-soup.name",
  "icon": "icons/tools/laboratory/mortar-liquid-pink.webp",
  "basicIngredients": 6,
  "specialIngredients": 3,
  "cookingLoreDC": 40,
  "survivalDC": 42,
  "uuid": "Compendium.pf2e-kingmaker-tools.kingmaker-tools-meal-effects.yAB0s5JgzCZpf0dT",
  "level": 16,
  "cost": {
    "currency": "gp",
    "value": 500
  },
  "rarity": "rare",
  "favoriteMeal": {
    "effects": [
      {
        "uuid": "Compendium.pf2e-kingmaker-tools.kingmaker-tools-meal-effects.Item.6RjaP1s58ITIVn6u"
      }
    ]
  },
  "success": {
    "effects": [
      {
        "uuid": "Compendium.pf2e-kingmaker-tools.kingmaker-tools-meal-effects.Item.Zn0CB7bL7vHrMNTU"
      }
    ]
  },
  "criticalSuccess": {
    "effects": [
      {
        "uuid": "Compendium.pf2e-kingmaker-tools.kingmaker-tools-meal-effects.Item.hLGCjXajAYEcII9J"
      }
    ]
  },
  "criticalFailure": {
    "effects": [
      {
        "uuid": "Compendium.pf2e-kingmaker-tools.kingmaker-tools-meal-effects.Item.o6F8QZbTvt9os8Ni",
        "removeWhenPreparingCampsite": false
      },
      {
        "uuid": "Compendium.pf2e-kingmaker-tools.kingmaker-tools-meal-effects.Item.TQXXVzD1ZZHnouTI",
        "removeWhenPreparingCampsite": false
      },
      {
        "uuid": "Compendium.pf2e-kingmaker-tools.kingmaker-tools-meal-effects.Item.SJvEGeMryIekwIKk",
        "removeWhenPreparingCampsite": false
      }
    ]
  },
  "requirements": "master in Nature"
}
