{
  "id": "black-linnorm-stew",
  "name": "recipes.black-linnorm-stew.name",
  "icon": "icons/tools/cooking/bowl-steaming-brown.webp",
  "basicIngredients": 8,
  "specialIngredients": 3,
  "cookingLoreDC": 43,
  "survivalDC": 45,
  "uuid": "Compendium.pf2e-kingmaker-tools.kingmaker-tools-meal-effects.V6uIWe6BVFV9Ewo3",
  "level": 18,
  "cost": {
    "currency": "gp",
    "value": 1200
  },
  "rarity": "rare",
  "criticalSuccess": {
    "effects": [
      {
        "uuid": "Compendium.pf2e-kingmaker-tools.kingmaker-tools-meal-effects.Item.I2LiwNjrowS5u4UG"
      }
    ]
  },
  "success": {
    "effects": [
      {
        "uuid": "Compendium.pf2e-kingmaker-tools.kingmaker-tools-meal-effects.Item.m3FgRCWbVupkaORL"
      }
    ]
  },
  "criticalFailure": {
    "effects": [
      {
        "uuid": "Compendium.pf2e-kingmaker-tools.kingmaker-tools-meal-effects.Item.s1DfJpXFkJorHsuu",
        "removeWhenPreparingCampsite": false
      }
    ]
  },
  "favoriteMeal": {
    "effects": [
      {
        "uuid": "Compendium.pf2e-kingmaker-tools.kingmaker-tools-meal-effects.Item.sxr0BsJJGeLyNBgq"
      }
    ]
  },
  "requirements": "master in Arcana or Nature"
}
