{
  "id": "rice-n-nut-pudding",
  "name": "recipes.rice-n-nut-pudding.name",
  "icon": "icons/consumables/food/pot-soup-white.webp",
  "basicIngredients": 2,
  "specialIngredients": 1,
  "cookingLoreDC": 16,
  "survivalDC": 18,
  "uuid": "Compendium.pf2e-kingmaker-tools.kingmaker-tools-meal-effects.IrrRh2yttdTDU1A5",
  "level": 2,
  "cost": {
    "currency": "gp",
    "value": 2
  },
  "rarity": "common",
  "criticalSuccess": {
    "effects": [
      {
        "uuid": "Compendium.pf2e-kingmaker-tools.kingmaker-tools-meal-effects.Item.3Gj0AaUzqwN0CdTi",
        "removeWhenPreparingCampsite": false
      }
    ]
  },
  "criticalFailure": {
    "effects": [
      {
        "uuid": "Compendium.pf2e-kingmaker-tools.kingmaker-tools-meal-effects.Item.AI1hYVSAMmKgEO9u",
        "removeWhenPreparingCampsite": false
      }
    ]
  },
  "success": {
    "effects": [
      {
        "uuid": "Compendium.pf2e-kingmaker-tools.kingmaker-tools-meal-effects.Item.GzZYeBB1UGMAykXc",
        "removeAfterRest": true
      }
    ]
  },
  "favoriteMeal": {
    "effects": [
      {
        "uuid": "Compendium.pf2e-kingmaker-tools.kingmaker-tools-meal-effects.Item.IRTWUl4HjRa82A1B",
        "removeWhenPreparingCampsite": false
      }
    ]
  },
  "requirements": "trained in Arcana"
}
